{
  "$schema": "../../schemas/stack-state-v1.schema.json",
  "formatVersion": 1,
  "kind": "only-my-pi-stack-state",
  "status": "INSTALLED",
  "activeStack": "sha256:89d1dfd03bd655f89e3ea906b3ad7ee3709a8c5204c4f42dc204db0a41d7422d",
  "lkgStack": "sha256:de6b2c654dd0fab4362a8de0f935bdc43f60bf5687116871e0e6c76d7db3b13c",
  "manifestDigest": "sha256:89d1dfd03bd655f89e3ea906b3ad7ee3709a8c5204c4f42dc204db0a41d7422d",
  "payloadMode": "thin",
  "node": {
    "version": "24.19.0",
    "digest": "sha256:b35ac8e304b78d2c286a520b017dc89dadaf4d569100c383309e29926a15eb66"
  },
  "pi": {
    "version": "0.84.3",
    "digest": "sha256:a8052436555f6b0e36899dd1485c4b6fc8fbd1d009686d112ca3902fcc0e9214"
  },
  "onlyMyPi": {
    "version": "0.2.0-preview.1",
    "digest": "sha256:3c8df12258963be989a905c87eaef675b0e69b624346984eb1ebe91b53541023"
  },
  "generation": {
    "version": "generation-v1",
    "digest": "sha256:d62894d19e6bfd498b4284174beaa9233e0e6e460c2e40dc5e56aa510cf7ad5f"
  },
  "cliArtifact": {
    "version": "0.2.0-preview.1",
    "digest": "sha256:3c8df12258963be989a905c87eaef675b0e69b624346984eb1ebe91b53541023"
  },
  "shims": {
    "omp": {
      "targetClass": "USER_LOCAL_CONTROLLED_STACK",
      "digest": "sha256:04bac47d21e34f82281a038009d860f35c09a69a690f026f90437b800431ca4f"
    },
    "pi": {
      "targetClass": "USER_LOCAL_CONTROLLED_STACK",
      "digest": "sha256:99acaa395892bb747b0c3127724dad313a02ae104277c02f147b1e0baa553441"
    }
  },
  "externalTree": {
    "digest": "sha256:19215c20c6a4e65363cdeab6382ea03d8078aac4f488a2fc86d959b926c40c45",
    "verificationBasis": "CANONICAL_RELEASE_TREE"
  },
  "externalPackages": [
    {
      "name": "@narumitw/pi-plan-mode",
      "version": "0.55.2",
      "binding": "external",
      "owner": "user",
      "assetDisposition": "PROVISIONED_FOR_USER",
      "treeDigest": "sha256:67c595f58089b75405135bb442c96c7b76204c6b0274d67f81aa4545077cf453"
    },
    {
      "name": "pi-agent-extensions",
      "version": "0.5.4",
      "binding": "external",
      "owner": "user",
      "assetDisposition": "PROVISIONED_FOR_USER",
      "treeDigest": "sha256:892538cf0ca14b5f7b18af242553d81ba96e3020f86fc29c0f05cd7800f03cfa"
    },
    {
      "name": "pi-web-access",
      "version": "0.25.0",
      "binding": "external",
      "owner": "user",
      "assetDisposition": "PROVISIONED_FOR_USER",
      "treeDigest": "sha256:29b904d3443ceb1058bb2fbafe769111ae6cc0ac7ebbbed7e7401fbed224512b"
    },
    {
      "name": "pi-subagents",
      "version": "0.57.0",
      "binding": "external",
      "owner": "user",
      "assetDisposition": "PROVISIONED_FOR_USER",
      "treeDigest": "sha256:d77c41c425cb67f58d78fb8862b312616654fb0bf7e140cc9f1c120019b4376e"
    },
    {
      "name": "pi-permission-modes",
      "version": "2.2.0",
      "binding": "external",
      "owner": "user",
      "assetDisposition": "PROVISIONED_FOR_USER",
      "treeDigest": "sha256:266ae2763cfe6accd95fc83b81d3ce534112cbd075c519dae25e5ccf50479f4c"
    },
    {
      "name": "@narumitw/pi-lsp",
      "version": "0.49.6",
      "binding": "external",
      "owner": "user",
      "assetDisposition": "PROVISIONED_FOR_USER",
      "treeDigest": "sha256:34163dae1ab9c5ab7f11b898ef09f9966e7d7de78b5d45db2bfc0767dd521122"
    },
    {
      "name": "@sreetej510/pi-usage",
      "version": "0.7.1",
      "binding": "external",
      "owner": "user",
      "assetDisposition": "PROVISIONED_FOR_USER",
      "treeDigest": "sha256:9228ab14b6516df7916826fcf869e7e5dafa5a5974a63e9ec8fa1bd738da018b"
    },
    {
      "name": "pi-memory",
      "version": "0.4.1",
      "binding": "external",
      "owner": "user",
      "assetDisposition": "PROVISIONED_FOR_USER",
      "treeDigest": "sha256:ddd732824ab356c046d2524ad1817cb41dc10bae4d39ab21b408b4dbc348b535"
    },
    {
      "name": "pi-git-sync",
      "version": "0.1.3",
      "binding": "external",
      "owner": "user",
      "assetDisposition": "PROVISIONED_FOR_USER",
      "treeDigest": "sha256:e6cea9fcd317039d01395198805e68950e071a1b5083e5d1f8443e3d4d56dc17"
    }
  ],
  "transactionIds": [
    "00000000-0000-4000-8000-000000000001"
  ],
  "removalEligibility": {
    "stack": true,
    "externalTree": true,
    "reasonCodes": []
  },
  "stateDigest": "sha256:bb492a8582f6435cf235336131370086904059da5403ea85a6dbc57895d1c901"
}
